{
  "schema": "forever-rank/character-export",
  "schemaVersion": 1,
  "collector": {
    "name": "ForeverRankCollector",
    "version": "0.1.0"
  },
  "observedAt": 1791352200,
  "observedAtSource": "GetServerTime",
  "trigger": "logout",
  "client": {
    "buildVersion": "0.0.0",
    "buildNumber": "00000",
    "interfaceVersion": 16001,
    "regionId": 901,
    "locale": "koKR"
  },
  "gameMode": {
    "activeGameMode": 902
  },
  "character": {
    "guid": "FIXTURE-GUID-0003",
    "name": "장비부족",
    "surname": "캐릭터",
    "level": 20,
    "classFile": "TESTCLASS",
    "className": "테스트직업",
    "raceFile": "TestRace",
    "raceName": "테스트종족",
    "faction": "TestFaction",
    "factionName": "테스트진영",
    "isInGuild": true,
    "guildName": "가상 길드"
  },
  "gear": [
    {
      "slotName": "HeadSlot",
      "slotId": 100,
      "itemId": 5000,
      "itemLink": "|cff0070dd|Hitem:5000::::|h[테스트 아이템 0]|h|r",
      "itemLevel": 37,
      "quality": 3,
      "inventoryType": 1
    },
    {
      "slotName": "NeckSlot",
      "slotId": 101,
      "itemId": 5001,
      "itemLink": "|cff0070dd|Hitem:5001::::|h[테스트 아이템 1]|h|r",
      "itemLevel": 20,
      "quality": 3,
      "inventoryType": 1
    },
    {
      "slotName": "ShoulderSlot",
      "slotId": 102,
      "itemId": 5002,
      "itemLink": "|cff0070dd|Hitem:5002::::|h[테스트 아이템 2]|h|r",
      "itemLevel": 20,
      "quality": 3,
      "inventoryType": 1
    },
    {
      "slotName": "BackSlot",
      "slotId": 103,
      "itemId": 5003,
      "itemLink": "|cff0070dd|Hitem:5003::::|h[테스트 아이템 3]|h|r",
      "itemLevel": 20,
      "quality": 3,
      "inventoryType": 1
    },
    {
      "slotName": "ChestSlot",
      "slotId": 104,
      "itemId": 5004,
      "itemLink": "|cff0070dd|Hitem:5004::::|h[테스트 아이템 4]|h|r",
      "itemLevel": 20,
      "quality": 3,
      "inventoryType": 1
    }
  ],
  "levelEvents": [
    {
      "level": 20,
      "observedAt": 1791349200,
      "event": "PLAYER_LEVEL_UP"
    }
  ],
  "unavailable": []
}
