{
  "schema": "forever-rank/character-export",
  "schemaVersion": 1,
  "collector": {
    "name": "ForeverRankCollector",
    "version": "0.1.0"
  },
  "observedAt": 1791352200,
  "observedAtSource": "GetServerTime",
  "trigger": "logout",
  "client": {
    "buildVersion": "0.0.0",
    "buildNumber": "00000",
    "interfaceVersion": 16001,
    "regionId": 901,
    "locale": "koKR"
  },
  "gameMode": {
    "activeGameMode": 902
  },
  "character": {
    "guid": "FIXTURE-GUID-0001",
    "name": "가상",
    "surname": "캐릭터",
    "level": 20,
    "classFile": "TESTCLASS",
    "className": "테스트직업",
    "raceFile": "TestRace",
    "raceName": "테스트종족",
    "faction": "TestFaction",
    "factionName": "테스트진영",
    "isInGuild": true,
    "guildName": "가상 길드"
  },
  "gear": [
    {
      "slotName": "HeadSlot",
      "slotId": 100,
      "itemId": 5000,
      "itemLink": "|cff0070dd|Hitem:5000::::|h[테스트 아이템 0]|h|r",
      "itemLevel": 37,
      "quality": 3,
      "inventoryType": 1
    },
    {
      "slotName": "NeckSlot",
      "slotId": 101,
      "itemId": 5001,
      "itemLink": "|cff0070dd|Hitem:5001::::|h[테스트 아이템 1]|h|r",
      "itemLevel": 20,
      "quality": 3,
      "inventoryType": 1
    },
    {
      "slotName": "ShoulderSlot",
      "slotId": 102,
      "itemId": 5002,
      "itemLink": "|cff0070dd|Hitem:5002::::|h[테스트 아이템 2]|h|r",
      "itemLevel": 20,
      "quality": 3,
      "inventoryType": 1
    },
    {
      "slotName": "BackSlot",
      "slotId": 103,
      "itemId": 5003,
      "itemLink": "|cff0070dd|Hitem:5003::::|h[테스트 아이템 3]|h|r",
      "itemLevel": 20,
      "quality": 3,
      "inventoryType": 1
    },
    {
      "slotName": "ChestSlot",
      "slotId": 104,
      "itemId": 5004,
      "itemLink": "|cff0070dd|Hitem:5004::::|h[테스트 아이템 4]|h|r",
      "itemLevel": 20,
      "quality": 3,
      "inventoryType": 1
    },
    {
      "slotName": "WristSlot",
      "slotId": 105,
      "itemId": 5005,
      "itemLink": "|cff0070dd|Hitem:5005::::|h[테스트 아이템 5]|h|r",
      "itemLevel": 20,
      "quality": 3,
      "inventoryType": 1
    },
    {
      "slotName": "HandsSlot",
      "slotId": 106,
      "itemId": 5006,
      "itemLink": "|cff0070dd|Hitem:5006::::|h[테스트 아이템 6]|h|r",
      "itemLevel": 20,
      "quality": 3,
      "inventoryType": 1
    },
    {
      "slotName": "WaistSlot",
      "slotId": 107,
      "itemId": 5007,
      "itemLink": "|cff0070dd|Hitem:5007::::|h[테스트 아이템 7]|h|r",
      "itemLevel": 20,
      "quality": 3,
      "inventoryType": 1
    },
    {
      "slotName": "LegsSlot",
      "slotId": 108,
      "itemId": 5008,
      "itemLink": "|cff0070dd|Hitem:5008::::|h[테스트 아이템 8]|h|r",
      "itemLevel": 20,
      "quality": 3,
      "inventoryType": 1
    },
    {
      "slotName": "FeetSlot",
      "slotId": 109,
      "itemId": 5009,
      "itemLink": "|cff0070dd|Hitem:5009::::|h[테스트 아이템 9]|h|r",
      "itemLevel": 20,
      "quality": 3,
      "inventoryType": 1
    },
    {
      "slotName": "Finger0Slot",
      "slotId": 110,
      "itemId": 5010,
      "itemLink": "|cff0070dd|Hitem:5010::::|h[테스트 아이템 10]|h|r",
      "itemLevel": 20,
      "quality": 3,
      "inventoryType": 1
    },
    {
      "slotName": "Finger1Slot",
      "slotId": 111,
      "itemId": 5011,
      "itemLink": "|cff0070dd|Hitem:5011::::|h[테스트 아이템 11]|h|r",
      "itemLevel": 20,
      "quality": 3,
      "inventoryType": 1
    },
    {
      "slotName": "Trinket0Slot",
      "slotId": 112,
      "itemId": 5012,
      "itemLink": "|cff0070dd|Hitem:5012::::|h[테스트 아이템 12]|h|r",
      "itemLevel": 20,
      "quality": 3,
      "inventoryType": 1
    },
    {
      "slotName": "Trinket1Slot",
      "slotId": 113,
      "itemId": 5013,
      "itemLink": "|cff0070dd|Hitem:5013::::|h[테스트 아이템 13]|h|r",
      "itemLevel": 20,
      "quality": 3,
      "inventoryType": 1
    },
    {
      "slotName": "MainHandSlot",
      "slotId": 114,
      "itemId": 5014,
      "itemLink": "|cff0070dd|Hitem:5014::::|h[테스트 아이템 14]|h|r",
      "itemLevel": 20,
      "quality": 3,
      "inventoryType": 1
    },
    {
      "slotName": "SecondaryHandSlot",
      "slotId": 115,
      "itemId": 5015,
      "itemLink": "|cff0070dd|Hitem:5015::::|h[테스트 아이템 15]|h|r",
      "itemLevel": 20,
      "quality": 3,
      "inventoryType": 1
    },
    {
      "slotName": "RangedSlot",
      "slotId": 116,
      "itemId": 5016,
      "itemLink": "|cff0070dd|Hitem:5016::::|h[테스트 아이템 16]|h|r",
      "itemLevel": 20,
      "quality": 3,
      "inventoryType": 1
    }
  ],
  "levelEvents": [
    {
      "level": 20,
      "observedAt": 1791349200,
      "event": "PLAYER_LEVEL_UP"
    }
  ],
  "unavailable": []
}
